{
  "schema_version": 1,
  "objective_id": "obj-ae-commissioning-001",
  "kind": "OWNER_OBJECTIVE",
  "created_at": "2026-09-24T00:00:00Z",
  "requested_by": "owner ACK M6 Phase 1 2026-09-27 final TCB (synthetic commissioning only)",
  "title": "AE v1 commissioning: regression test for clamp_percent boundaries",
  "statement": "Добавь регрессионный тест граничных случаев функции clamp_percent из tools/commissioning/ae_canary.py в НОВЫЙ модуль tools/tests/test_ae_commissioning_canary.py: значения ниже 0, выше 100, ровно 0 и 100, дробное внутри отрезка и NaN (ValueError). Саму функцию и любые другие файлы НЕ меняй.",
  "incident": null,
  "acceptance": [
    "изменён ровно один файл: новый tools/tests/test_ae_commissioning_canary.py",
    "pytest tools/tests проходит; новый тест покрывает шесть перечисленных случаев",
    "tools/commissioning/ae_canary.py не изменён",
    "production-мутаций: 0"
  ],
  "constraints": [
    "синтетическая цель ввода в эксплуатацию: production, данные и бизнес-правила не затрагиваются",
    "не трогать доверенную базу (trusted_computing_base) политики AE"
  ],
  "repository_sha": "73bf86dd965cb15fd176f0bec06a0cb134a3e7f0",
  "affected_assets": [],
  "downstream_consumers": [],
  "contract_suites": [],
  "known_ubr_links": [],
  "evidence": {
    "note": "M6 Phase 1 на финальном TCB (CLI 2.1.280 + выключатель телеметрии); Phase 0 PASS (run 36317729529); прошлые попытки: теги ae-evidence/m6-phase1-attempt1-20260925, ae-evidence/m6-phase1-attempt2-20260927"
  },
  "owner_ack": null,
  "deduplication_key": "objective:AE-COMMISSIONING-001",
  "execute": true,
  "commissioning": {
    "iteration_marker": "AE-COMMISSIONING-ITERATION-OK"
  }
}
